{
  "$schema": "https://json-schema.org/draft/2020-12/schema",
  "title": "Go Odyssey release manifest",
  "type": "object",
  "additionalProperties": false,
  "required": [
    "release_git_sha",
    "image_tag",
    "image_id",
    "image_archive_filename",
    "archive_sha256",
    "oci_revision",
    "oci_source",
    "sgf_engine_source_commit",
    "build_timestamp",
    "build_machine_identity_class",
    "target_service_names",
    "external_content_requirements",
    "questions_corpus_sha256",
    "questions_corpus_record_count",
    "questions_corpus_bytes",
    "questions_corpus_snapshot_id",
    "questions_corpus_source_identity",
    "questions_corpus_source_sha256",
    "questions_corpus_source_record_count",
    "expected_health_endpoints",
    "rollback_image_identity",
    "deployment_timestamp",
    "verification_result"
  ],
  "properties": {
    "$schema": { "type": "string" },
    "release_git_sha": { "type": "string", "pattern": "^[0-9a-f]{40}$" },
    "image_tag": { "type": "string", "minLength": 1 },
    "image_id": { "type": "string", "pattern": "^sha256:[0-9a-f]{64}$" },
    "image_archive_filename": { "type": "string", "minLength": 1 },
    "archive_sha256": { "type": "string", "pattern": "^[0-9a-f]{64}$" },
    "oci_revision": { "type": "string", "pattern": "^[0-9a-f]{40}$" },
    "oci_source": { "type": "string", "minLength": 1 },
    "sgf_engine_source_commit": { "type": "string", "pattern": "^[0-9a-f]{40}$" },
    "build_timestamp": { "type": "string", "minLength": 1 },
    "build_machine_identity_class": { "type": "string", "minLength": 1 },
    "target_service_names": {
      "type": "array",
      "minItems": 1,
      "items": { "type": "string", "minLength": 1 }
    },
    "external_content_requirements": {
      "type": "object",
      "additionalProperties": false,
      "required": [
        "asset_source_path",
        "asset_container_mount_destination",
        "questions_content_source_path",
        "questions_content_mount_destination",
        "shadow_event_log_path"
      ],
      "properties": {
        "asset_source_path": { "type": "string", "minLength": 1 },
        "asset_container_mount_destination": { "type": "string", "minLength": 1 },
        "questions_content_source_path": { "type": "string", "minLength": 1 },
        "questions_content_mount_destination": { "type": "string", "minLength": 1 },
        "shadow_event_log_path": { "type": "string", "minLength": 1 }
      }
    },
    "questions_corpus_sha256": { "type": "string", "pattern": "^[0-9a-f]{64}$" },
    "questions_corpus_record_count": { "type": "integer", "minimum": 1 },
    "questions_corpus_bytes": { "type": "integer", "minimum": 1 },
    "questions_corpus_snapshot_id": {
      "type": "string",
      "pattern": "^[A-Za-z0-9][A-Za-z0-9._:-]{0,255}$"
    },
    "questions_corpus_source_identity": { "type": "string", "pattern": "^[0-9a-f]{64}$" },
    "questions_corpus_source_sha256": { "type": "string", "pattern": "^[0-9a-f]{64}$" },
    "questions_corpus_source_record_count": { "type": "integer", "minimum": 1 },
    "expected_health_endpoints": {
      "type": "array",
      "minItems": 1,
      "items": { "type": "string", "minLength": 1 }
    },
    "rollback_image_identity": {
      "anyOf": [
        { "type": "null" },
        {
          "type": "object",
          "additionalProperties": true
        }
      ]
    },
    "deployment_timestamp": {
      "anyOf": [
        { "type": "null" },
        { "type": "string", "minLength": 1 }
      ]
    },
    "verification_result": {
      "anyOf": [
        { "type": "null" },
        { "type": "string", "minLength": 1 }
      ]
    }
  }
}
